{
  "$schema": "http://json-schema.org/draft-07/schema#",
  "$id": "https://aer.sequence.org/schemas/v1/DeterministicFraudProof.schema.json",
  "title": "Deterministic Fault Proof Specification (AST Invariant Violation & WASM Trap Assertion)",
  "description": "Cryptographically authenticated fault proof format verifying reproducible state-machine failures, abstract syntax tree (AST) invariant violations, kinematic boundary exceedances, or unhandled execution traps. Triggers an immediate suspension of the optimistic timelock countdown within the on-chain escrow layer (AER Section 4.4.3).",
  "type": "object",
  "required": [
    "schema_version",
    "task_id",
    "reporter_node_id",
    "worker_node_id",
    "defect_type",
    "proof_payload",
    "deterministic_evaluator_digest",
    "timestamp",
    "reporter_signature"
  ],
  "additionalProperties": false,
  "properties": {
    "schema_version": {
      "type": "string",
      "pattern": "^1\\.[0-9]+\\.[0-9]+$",
      "description": "Semantic versioning string of this formal schema specification (e.g. 1.0.0)."
    },
    "task_id": {
      "type": "string",
      "pattern": "^0x[a-fA-F0-9]{64}$",
      "description": "32-byte cryptographic identifier of the disputed escrow contract."
    },
    "reporter_node_id": {
      "type": "string",
      "pattern": "^0x[a-fA-F0-9]{40}$",
      "description": "EVM address of the asserting entity (client, automated referee, or watchtower node)."
    },
    "worker_node_id": {
      "type": "string",
      "pattern": "^0x[a-fA-F0-9]{40}$",
      "description": "EVM address of the respondent executor accused of submitting non-conforming execution outputs."
    },
    "defect_type": {
      "type": "string",
      "enum": [
        "AST_SYNTAX_ERROR",
        "KINEMATIC_VIOLATION",
        "COMPILATION_CRASH",
        "SCHEMA_MALFORMED",
        "OUT_OF_BOUNDS_MEMORY"
      ],
      "description": "Deterministic, non-subjective failure category verifiable via an isolated sandbox or formal grammar engine."
    },
    "proof_payload": {
      "type": "object",
      "required": [
        "source_artifact_hash",
        "error_code",
        "reproduction_trace",
        "evaluator_version"
      ],
      "additionalProperties": false,
      "properties": {
        "source_artifact_hash": {
          "type": "string",
          "pattern": "^0x[a-fA-F0-9]{64}$",
          "description": "SHA-256 cryptographic digest of the exact artifact triggering the deterministic trap or assertion."
        },
        "error_code": {
          "type": "string",
          "maxLength": 64,
          "description": "Canonical runtime error code (e.g. WASM_TRAP_UNREACHABLE, AST_SYNTAX_ERROR_EOF, KINEMATIC_TORQUE_LIMIT_EXCEEDED)."
        },
        "reproduction_trace": {
          "type": "string",
          "description": "Deterministic sequence trace, bytecode instruction offset, or line/column coordinate reproducing the failure."
        },
        "evaluator_version": {
          "type": "string",
          "maxLength": 64,
          "description": "Standardized canonical runtime environment identifier (e.g. wasmtime-21.0.0, cpython-3.12-ast)."
        }
      }
    },
    "deterministic_evaluator_digest": {
      "type": "string",
      "pattern": "^0x[a-fA-F0-9]{64}$",
      "description": "SHA-256 binary digest of the deterministic referee engine or WebAssembly verification kernel."
    },
    "timestamp": {
      "type": "integer",
      "minimum": 1700000000,
      "description": "Unix epoch timestamp in seconds recording proof compilation."
    },
    "reporter_signature": {
      "type": "string",
      "pattern": "^0x[a-fA-F0-9]{130}$",
      "description": "65-byte ECDSA cryptographic signature generated by the reporter authorizing the dispute submission."
    }
  }
}
